{
  "bus": [
    "i2c"
  ],
  "confidence": 0.8,
  "constructors": [
    "PCF8575(i2c, address, interrupt_pin, callback)",
    "SSD1306_I2C(i2c, addr, width, height, external_vcc)"
  ],
  "evidence_refs": [
    {
      "path": "menu.py",
      "type": "source"
    },
    {
      "path": "pcf8575.py",
      "type": "source"
    },
    {
      "path": "pcf8575_led.py",
      "type": "source"
    },
    {
      "path": "pcf8575_menu.py",
      "type": "source"
    },
    {
      "path": "SSD1306.py",
      "type": "source"
    },
    {
      "path": "README.md",
      "type": "readme"
    }
  ],
  "examples": [
    "# -*- coding: utf-8 -*-\nfrom machine import I2C, Pin\nimport time\nfrom pcf8575 import PCF8575\n\n# 初始化I2C总线（SDA=6、SCL=7，频率400KHz）\ni2c = I2C(id=1, sda=Pin(6), scl=Pin(7), freq=400000)\n\n# 扫描I2C设备，获取PCF8575地址（0x20-0x27）\ndevices = i2c.scan()\npcf8575_addr = next((d for d in devices if 0x20 <= d <= 0x27), 0x20)\n\n# 初始化PCF8575\npcf8575 = PCF8575(i2c, pcf8575_addr)\n\n# 8路LED流水灯逻辑\nLED_COUNT = 8\nwhile True:\n    pcf8575.port = 0x00FF  # 熄灭所有LED\n    time.sleep(0.5)\n    \n    # 逐一点亮LED\n    for i in range(LED_COUNT):\n        pcf8575.pin(i, False)  # 低电平点亮LED\n        time.sleep(0.2)\n        # 打印低8位引脚状态（二进制）\n        print(\"LED State: {:08b}\".format(pcf8575.port & 0xFF))\n    \n    time.sleep(0.5)",
    "# -*- coding: utf-8 -*-\nfrom machine import I2C, Pin\nimport time\nfrom pcf8575 import PCF8575\nfrom SSD1306 import SSD1306_I2C\nfrom menu import SimpleOLEDMenu\n\n# 初始化I2C\ni2c = I2C(id=1, sda=Pin(6), scl=Pin(7), freq=400000)\n\n# 初始化PCF8575（中断引脚8，回调函数detect_interrupt）\npcf8575 = PCF8575(i2c, 0x20, interrupt_pin=Pin(8), callback=lambda pin: detect_interrupt(pin))\n\n# 初始化OLED屏幕（128x64，地址0x3C）\noled = SSD1306_I2C(i2c, 0x3C, 128, 64, False)\n\n# 初始化OLED菜单\nmenu = SimpleOLEDMenu(oled, \"Main Menu\", 0, 0, 128, 64)\nmenu.add_menu(\"LED Option\")\nmenu.add_menu(\"LED ON\", parent_name=\"LED Option\", enter_callback=lambda: print(\"LED ON\"))\nmenu.add_menu(\"LED OFF\", parent_name=\"LED Option\", enter_callback=lambda: print(\"LED OFF\"))\nmenu.display_menu()\n\n# 简化版中断处理函数:识别按键并更新菜单\ndef detect_interrupt(pin):\n    key_map = {\n        0b1000000011111111: \"UP\",\n        0b0000100011111111: \"DOWN\"\n    }\n    current_port = pcf8575.port\n    if current_port in key_map:\n        if key_map[current_port] == \"UP\":\n            menu.select_up()\n        elif key_map[current_port] == \"DOWN\":\n            menu.select_down()\n        menu.display_menu()\n\n# 主循环\nwhile True:\n    time.sleep(0.1)",
    "MIT License\n\nCopyright (c) 2026 FreakStudio\n\nPermission is hereby granted, free of charge, to any person obtaining a copy\nof this software and associated documentation files (the \"Software\"), to deal\nin the Software without restriction, including without limitation the rights\nto use, copy, modify, merge, publish, distribute, sublicense, and/or sell\ncopies of the Software, and to permit persons to whom the Software is\nfurnished to do so, subject to the following conditions:\n\nThe above copyright notice and this permission notice shall be included in all\ncopies or substantial portions of the Software.\n\nTHE SOFTWARE IS PROVIDED \"AS IS\", WITHOUT WARRANTY OF ANY KIND, EXPRESS OR\nIMPLIED, INCLUDING BUT NOT LIMITED TO THE WARRANTIES OF MERCHANTABILITY,\nFITNESS FOR A PARTICULAR PURPOSE AND NONINFRINGEMENT. IN NO EVENT SHALL THE\nAUTHORS OR COPYRIGHT HOLDERS BE LIABLE FOR ANY CLAIM, DAMAGES OR OTHER\nLIABILITY, WHETHER IN AN ACTION OF CONTRACT, TORT OR OTHERWISE, ARISING FROM,\nOUT OF OR IN CONNECTION WITH THE SOFTWARE OR THE USE OR OTHER DEALINGS IN THE\nSOFTWARE."
  ],
  "import_names": [
    "pcf8575",
    "SSD1306",
    "menu",
    "pcf8575_led",
    "pcf8575_menu"
  ],
  "install": {
    "method": "mpremote mip install",
    "url": "github:FreakStudioCN/GraftSense-Drivers-MicroPython/input/pcf8575_driver"
  },
  "known_issues": [],
  "pin_roles": [
    "i2c_sda",
    "i2c_scl"
  ],
  "read_methods": [
    "check",
    "contrast",
    "init_display",
    "invert",
    "pin",
    "poweroff",
    "poweron",
    "show",
    "toggle",
    "write_cmd",
    "write_data"
  ],
  "read_properties": [
    "port"
  ],
  "support_level": "generatable"
}
