{
  "import_names": [
    "mcp23017"
  ],
  "constructors": [
    "MCP23017(i2c)"
  ],
  "read_methods": [
    "config",
    "default_value",
    "gpio",
    "init",
    "input",
    "input_polarity",
    "interrupt_captured",
    "interrupt_captured_gpio",
    "interrupt_compare_default",
    "interrupt_enable",
    "interrupt_flag",
    "interrupt_triggered_gpio",
    "io_config",
    "mode",
    "output",
    "output_latch",
    "pin",
    "pullup",
    "value"
  ],
  "read_properties": [],
  "bus": [
    "i2c"
  ],
  "pin_roles": [
    "i2c_sda",
    "i2c_scl"
  ],
  "install": {
    "method": "mpremote mip install",
    "url": "https://upypi.net/pkgs/mcp23017_driver/1.0.1/package.json"
  },
  "examples": [],
  "known_issues": [],
  "evidence_refs": [
    {
      "type": "source",
      "path": "mcp23017.py"
    }
  ],
  "confidence": 0.75,
  "support_level": "generatable"
}