{
  "bus": [
    "gpio"
  ],
  "confidence": 0.7,
  "constructors": [
    "GUVA_S12SD(analog_pin)"
  ],
  "evidence_refs": [
    {
      "path": "guva_s12sd.py",
      "type": "source"
    },
    {
      "path": "README.md",
      "type": "readme"
    }
  ],
  "examples": [
    "import time\nfrom guva_s12sd import GUVA_S12SD\n\n# 上电延时3s\ntime.sleep(3)\nprint(\"FreakStudio:  UV Sensor (GUVA-S12SD) Test Starting \")\n\n# 初始化传感器 (GP26 -> ADC0)\nsensor = GUVA_S12SD(26)\n\ntry:\n    while True:\n        try:\n            voltage = sensor.voltage\n            uvi = sensor.uvi\n            print(f\"Voltage: {voltage:.3f} V | UV Index: {uvi:.2f}\")\n        except RuntimeError as e:\n            print(f\"[Error] Failed to read sensor data: {e}\")\n\n        time.sleep(0.2)\n\nexcept ValueError as e:\n    print(f\"[Critical Error] Sensor initialization failed: {e}\")\nexcept Exception as e:\n    print(f\"[Unexpected Error] {e}\")",
    "MIT License\n\nCopyright (c) 2026 FreakStudio\n\nPermission is hereby granted, free of charge, to any person obtaining a copy\nof this software and associated documentation files (the \"Software\"), to deal\nin the Software without restriction, including without limitation the rights\nto use, copy, modify, merge, publish, distribute, sublicense, and/or sell\ncopies of the Software, and to permit persons to whom the Software is\nfurnished to do so, subject to the following conditions:\n\nThe above copyright notice and this permission notice shall be included in all\ncopies or substantial portions of the Software.\n\nTHE SOFTWARE IS PROVIDED \"AS IS\", WITHOUT WARRANTY OF ANY KIND, EXPRESS OR\nIMPLIED, INCLUDING BUT NOT LIMITED TO THE WARRANTIES OF MERCHANTABILITY,\nFITNESS FOR A PARTICULAR PURPOSE AND NONINFRINGEMENT. IN NO EVENT SHALL THE\nAUTHORS OR COPYRIGHT HOLDERS BE LIABLE FOR ANY CLAIM, DAMAGES OR OTHER\nLIABILITY, WHETHER IN AN ACTION OF CONTRACT, TORT OR OTHERWISE, ARISING FROM,\nOUT OF OR IN CONNECTION WITH THE SOFTWARE OR THE USE OR OTHER DEALINGS IN THE\nSOFTWARE."
  ],
  "import_names": [
    "guva_s12sd"
  ],
  "install": {
    "method": "mpremote mip install",
    "url": "github:FreakStudioCN/GraftSense-Drivers-MicroPython/sensors/guva_s12sd_driver"
  },
  "known_issues": [],
  "pin_roles": [
    "gpio"
  ],
  "read_methods": [
    "get_uv_index",
    "read"
  ],
  "read_properties": [
    "uvi",
    "voltage"
  ],
  "support_level": "generatable"
}
