{
  "import_names": [
    "gt911"
  ],
  "constructors": [
    "GT911(i2c)"
  ],
  "read_methods": [
    "available",
    "irq_callback",
    "read_id",
    "read_touch",
    "reflash_config",
    "reset"
  ],
  "read_properties": [],
  "bus": [
    "i2c"
  ],
  "pin_roles": [
    "i2c_sda",
    "i2c_scl"
  ],
  "install": {
    "method": "mpremote mip install",
    "url": "https://upypi.net/pkgs/gt911_driver/1.0.0/package.json"
  },
  "examples": [],
  "known_issues": [],
  "evidence_refs": [
    {
      "type": "source",
      "path": "gt911.py"
    }
  ],
  "confidence": 0.75,
  "support_level": "generatable"
}